video,last_seen,watched
2-D Quadrotor Control,47,276
3-D Quadrotor Control,30,219
"Time, Motion, and Trajectories",20,202
"Time, Motion, and Trajectories (continued)",13,177
Motion Planning for Quadrotors,13,187
Supplementary Material: Minimum Velocity Trajectories from the Euler-Lagrange Equations,4,164
Supplementary Material: Solving for Coefficients of Minimum Jerk Trajectories,6,149
Supplementary Material: Minimum Velocity Trajectories,1,146
Supplementary Material: Linearization of Quadrotor Equations of Motion,8,158
